{
  "brand_name": "Signal Desk",
  "system_name": "Signal System",
  "product_summary": "작은 팀과 개인 제작자를 위한 고집 있는 에디토리얼 업무 앱",
  "audiences": [
    "독립 창작자",
    "콘텐츠 팀",
    "브랜드 운영자"
  ],
  "brand_keywords": [
    "calm",
    "precise",
    "editorial",
    "trustworthy"
  ],
  "anti_keywords": [
    "generic",
    "noisy",
    "overdecorated",
    "playful"
  ],
  "tone_of_voice": [
    "clear",
    "warm",
    "confident"
  ],
  "visual_keywords": [
    "structured whitespace",
    "measured contrast",
    "text-first hierarchy"
  ],
  "interaction_keywords": [
    "predictable states",
    "low-noise motion",
    "deliberate emphasis"
  ],
  "platforms": [
    "web",
    "ios"
  ],
  "accessibility_targets": [
    "WCAG 2.2 AA"
  ],
  "product_primitives": [
    "workspace navigation",
    "rich text editor",
    "command palette",
    "dashboard cards",
    "data tables",
    "hero section",
    "feature grid",
    "social proof",
    "testimonial",
    "faq accordion",
    "landing cta section",
    "site footer",
    "site header",
    "pricing and plans"
  ],
  "reference_preferences": {
    "prioritize_sources_containing": [
      "typography",
      "accessibility",
      "components",
      "design token"
    ],
    "avoid_sources_containing": [
      "brand-only"
    ]
  },
  "color_reference": {
    "path": "/Users/sungwoon/Documents/designSystem/docs/color-reference.md",
    "preferred_families": [
      "Deep Reds",
      "Natural Reds",
      "Pastel Reds",
      "Standard Oranges",
      "Natural Oranges",
      "Pastel Oranges"
    ],
    "palette_strategy": {
      "mode": "brand-guided",
      "candidate_count": 3,
      "active_candidate": 1,
      "temperature": "warm",
      "contrast": "balanced",
      "diversity": "balanced",
      "surface_style": "tinted",
      "prefer_moods": [
        "세련됨",
        "신뢰감"
      ],
      "avoid_moods": [
        "달콤함",
        "귀여움"
      ]
    },
    "palette_expansion": {
      "enabled": true,
      "supporting_color_count": 12,
      "combination_count": 4,
      "prefer_pairings": true,
      "prefer_related_families": true
    },
    "notes": [
      "색상 레퍼런스는 semantic token 설계의 출발점으로 사용",
      "raw reference color를 그대로 전체 UI에 덮지 않기",
      "selected_colors와 palette_roles를 넣으면 manual override로 동작",
      "palette_expansion은 seed color를 기반으로 support, neutral, semantic state 후보를 확장합니다"
    ]
  }
}
